{
  "style_id": "business_report_modern",
  "name": "Business Report Modern",
  "description": "Clean board-report style with cover, summary, metrics, tables, and appendix.",
  "page": {
    "size": "A4",
    "orientation": "portrait",
    "margins": {
      "top": 56,
      "right": 56,
      "bottom": 56,
      "left": 56
    }
  },
  "typography": {
    "heading_font": "system-sans",
    "body_font": "system-sans",
    "base_size": 10
  },
  "colors": {
    "primary": "#1f3a5f",
    "accent": "#6b8fb3",
    "text": "#111827"
  },
  "components": [
    "cover",
    "toc",
    "section_header",
    "metric_card",
    "table",
    "callout",
    "appendix"
  ]
}
